{
  "$schema": "../label.schema.json",
  "id": "mm-p10",
  "goldsetVersion": 1,
  "source": {
    "sha256": "6514c87c6c040c86b996acb2e4a5663b5e0065084842280f6b0a94b4c964ac3e",
    "pageNumber": 10,
    "title": "Monster Manual"
  },
  "category": "two_column_sidebar",
  "heldOut": false,
  "status": "verified",
  "review": {
    "verifiedBy": "joel",
    "verifiedAt": "2026-10-29T20:55:31.354Z",
    "numbersChecked": true,
    "notes": ""
  },
  "text": "### ARMOR, WEAPON, AND TOOL PROFICIENCIES\n\nAssume that a creature is proficient with its armor, weapons, and tools. If you swap them out, you decide whether the creature is proficient with its new equipment.\n\nFor example, a hill giant typically wears hide armor and wields a greatclub. You could equip a hill giant with chain mail and a greataxe instead, and assume the giant is proficient with both, one or the other, or neither.\n\nSee the *Player's Handbook* for rules on using armor or weapons without proficiency.\n\n### DARKVISION\n\nA monster with darkvision can see in the dark within a specific radius. The monster can see in dim light within the radius as if it were bright light, and in darkness as if it were dim light. The monster can't discern color in darkness, on ly shades of gray. Many creatures that live underground have this special sense.\n\n#### T'REMORSENSE\n\nA monster with tremorsense can detect and pinpoint the origin of vibrations within a specific radius, provided that the monster and the source of the vibrations are in contact with the same ground or substance. Tremorsense can't be used to detect flying or incorporeal creatures. Many burrowing creatures, such as ankhegs and umber hulks, have this special sense.\n\n### T'RUESIGHT\n\nA monster with truesight can, out to a specific range, see in normal and magical darkness, see invisible creatures and objects, automatically detect visual iilusions and succeed on saving throws against them, and perceive the original form of a shapechanger or a creature that is transformed by magic. Furthermore, the monster can see into the Ethereal Plane within the same range.\n\n### LANGUAGES\n\nThe languages that a monster can speak are listed in alphabetical order. Sometimes a monster can understand a language but can't speak it, and this is noted in its entry. A\"- \" indicates that a creature neither speaks nor understands any language.\n\n### TELEPATHY\n\nTelepathy is a magical ability that a llows a monster to communicate mentally with another creature within a specified range. The contacted creature doesn't need to share a language with the monster to communicate in this way with it, but it must be able to understand at least one language. A creature without telepathy can receive and respond to telepathic messages but can't initiate or terminate a telepathic conversation.\n\nA telepathic monster doesn't need to see a contacted creature and can end the telepathic contact at any time. The contact is broken as soon as the two creatures are no longer within range of each other or if the telepathic monster contacts a different creature within range. A telepathic monster can initiate or te rminate a telepathic conversation without using an action, but while the monster is incapacitated, it can't initiate telepath ic contact, and any current contact is terminated.\n\nA creature within the area of an *antimagic field* or in any other location where magic doesn't function can't send or receive telepathic messages.\n\n# CHALLENGE\n\nA monster's challenge rating tells you how great a threat the monster is. An appropriately equipped and well-rested party of four adventurers should be able to defeat a monster that has a challenge rating equal to its level without suffering any deaths. For example, a party of four 3rd-level characters should find a monster with a challenge rating of 3 to be a worthy challenge, but not a deadly one.\n\nMonsters that are significantly weaker than 1st-level characters have a challenge rating lower than 1. Monsters with a challenge rating of 0 are insignificant except in large numbers; those with no effective attacks are worth no experience points, while those that have attacks are worth 10 XP each.\n\nSome monsters present a greater challenge than even a typical 20th-level party can handle. These monsters have a challenge rating of 21 or higher and are specifically designed to test player skill.\n\n## EXPERIENCE POINTS\n\nThe number of experience points (XP) a monster is worth is based on its cha llenge rating. Typically, XP is awarded for defeating the monster, although the DM may also award XP for neutralizing the threat posed by the monster in some other manner.\n\nUnless something tells you otherwise, a monster summoned by a spell or other magical ability is worth the XP noted in its stat block.\n\nThe *Dungeon Master's Guide* explains how to create encounters using XP budgets, as well as how to adjust an encounter's difficulty.\n\n### EXPERIENCE POINTS BY CHALLENGE RATING\n\n| Challenge | XP | Challenge | XP |\n| --- | --- | --- | --- |\n| 0 | 0 or 10 | 14 | 11,500 |\n| 1/8 | 25 | 15 | 13,000 |\n| 1/4 | 50 | 16 | 15,000 |\n| 1/2 | 100 | 17 | 18,000 |\n|  | 200 | 18 | 20,000 |\n| 2 | 450 | 19 | 22,000 |\n| 3 | 700 | 20 | 25,000 |\n| 4 | 1,100 | 21 | 33,000 |\n| 5 | 1,800 | 22 | 41,000 |\n| 6 | 2,300 | 23 | 50,000 |\n| 7 | 2,900 | 24 | 62,000 |\n| 8 | 3,900 | 25 | 75,000 |\n| 9 | 5,000 | 26 | 90,000 |\n| 10 | 5,900 | 27 | 105,000 |\n| 11 | 7,200 | 28 | 120,000 |\n| 12 | 8,400 | 29 | 135,000 |\n| 13 | 10,000 | 30 | 155,000 |\n|  |  |  |  |",
  "regions": [
    {
      "class": "table",
      "bbox": [
        0.511,
        0.589,
        0.8875,
        0.8719
      ]
    }
  ],
  "entities": []
}
