{
  "$schema": "../label.schema.json",
  "id": "phb-p083",
  "goldsetVersion": 1,
  "source": {
    "sha256": "ccd242684b0c6c2117d2fd614c2bc6a8d9b0c9db73cdc57509b8bc5b51997a2a",
    "pageNumber": 83,
    "title": "5th Edition - Players Handbook"
  },
  "category": "heavy_art",
  "heldOut": false,
  "status": "verified",
  "review": {
    "verifiedBy": "joel",
    "verifiedAt": "2026-10-29T03:01:52.627Z",
    "numbersChecked": true,
    "notes": ""
  },
  "text": "Paladin\n\nClad in plate armor that gleams in the sunlight despite the dust and grime of long travel, a human lays down her sword and shield and places her hands on a mortally wounded man. Divine radiance shines from her hands, the man's wounds knit closed, and his eyes open wide with amazement.\n\nA dwarf crouches behind an outcrop, his black cloak making him nearly invisible in the night, and watches an orc war band celebrating its recent victory. Silently, he stalks into their midst and whispers an oath, and two orcs are dead before they even realize he is there.\n\nSilver hair shining in a shaft of light that seems to illuminate only him, an elf laughs with exultation. His spear flashes like his eyes as he jabs again and again at a twisted giant, until at last his light overcomes its hideous darkness.\n\nWhatever their origin and their mission, paladins are united by their oaths to stand against the forces of evil. Whether sworn before a god's altar and the witness of a priest, in a sacred glade before nature spirits and fey beings, or in a moment of desperation and grief with the dead as the only witness, a paladin's oath is a powerful bond. It is a source of power that turns a devout warrior into a blessed champion.\n\nThe Cause of Righteousness\n\nA paladin swears to uphold justice and righteousness, to stand with the good things of the world against the encroaching darkness, and to hunt the forces of evil wherever they lurk. Different paladins focus on various aspects of the cause of righteousness, but all are bound by the oaths that grant them power to do their sacred work. Although many paladins are devoted to gods of good, a paladin's power comes as much from a commitment to justice itself as it does from a god.\n\nPaladins train for years to learn the skills of combat, mastering a variety of weapons and armor. Even so, their martial skills are secondary to the magical power they wield: power to heal the sick and injured, to smite the wicked and the undead, and to protect the innocent and those who join them in the fight for justice.\n\nBeyond the Mundane Life\n\nAlmost by definition, the life of a paladin is an adventuring life. Unless a lasting injury has taken him or her away from adventuring for a time, every paladin lives on the front lines of the cosmic struggle against",
  "regions": [
    {
      "class": "art",
      "bbox": [
        0,
        0,
        0.5,
        1
      ]
    }
  ],
  "entities": []
}
