{
  "$schema": "../label.schema.json",
  "id": "mm-p12",
  "goldsetVersion": 1,
  "source": {
    "sha256": "6514c87c6c040c86b996acb2e4a5663b5e0065084842280f6b0a94b4c964ac3e",
    "pageNumber": 12,
    "title": "Monster Manual"
  },
  "category": "two_column_sidebar",
  "heldOut": false,
  "status": "verified",
  "review": {
    "verifiedBy": "joel",
    "verifiedAt": "2026-10-29T20:59:19.958Z",
    "numbersChecked": true,
    "notes": ""
  },
  "text": "might be a manufactured item or a natural weapon, such as a claw or tail spike. For more information on different kinds of attacks, see the *Player's Handbook.*\n\n*Creature vs. Target.* The target of a melee or ranged attack is usually either one creature or one target, the difference being that a \"target\" can be a creature or an object.\n\n*Hit.* Any damage dealt or other effects that occur as a result of an attack hitting a target are described after the *\"Hit\"* notation. You have the option of taking average damage or rolling the damage; for this reason, both the average damage and the die expression are presented.\n\n*Miss.* If an attack has an effect that occurs on a miss, that information is presented after the *\"Miss:\"* notation.\n\n### MULTIATTACK\n\nA creature that can make multiple attacks on its turn has the Multiattack ability. A creature can't use Multiattack when making an opportunity attack, which must be a single melee attack.\n\n### AMMUNITION\n\nA monster carries enough ammunition to make its ranged attacks. You can assume that a monster has 2d4 pieces of ammunition for a thrown weapon attack, and 2d10 pieces of ammunition for a projectile weapon such as a bow or crossbow.\n\n## REACTIONS\n\nIf a monster can do something special with its reaction, that information is contained here. If a creature has no special reaction, this section is absent.\n\n## LIMITED USAGE\n\nSome special abilities have restrictions on the number of times they can be used.\n\n*X/Day.* The notation \"X/Day\" means a special ability can be used X number of times and that a monster must finish a long rest to regain expended uses. For example, \"1/Day\" means a special ability can be used once and that the monster must finish a long rest to use it again.\n\n*Recharge X-Y.* The notation \"Recharge X- Y\" means a monster can use a special ability once and that the ability then has a random chance of recharging during each subsequent round of combat. At the start of each of the monster's turns, roll a d6. If the roll is one of the numbers in the recharge notation, the monster regains the use of the special ability. The ability also recharges when the monster finishes a short or long rest.\n\n## GRAPPLE RULES FOR MONSTERS\n\nMany monsters have special attacks that allow them to quickly grapple prey. When a monster hits with such an attack, it doesn't need to make an additional ability check to determine whether the grapple succeeds, unless the attack says otherwise.\n\nA creature grappled by the monster can use its action to try to escape. To do so, it must succeed on a Strength (Athletics) or Dexterity (Acrobatics) check against the escape DC in the monster's stat block. If no escape DC is given, assume the DC is 10 +the monster's Strength (Athletics) modifier.\n\nFor example, \"Recharge 5- 6\" means a monster can use the special ability once. Then, at the start of the monster's turn, it regains the use of that ability if it rolls a 5 or 6 on a d6.\n\n*Recharge after a Short or Long Rest.* This notation means that a monster can use a special ability once and then must finish a short or long rest to use it again.\n\n# EQUIPMENT\n\nA stat block rarely refers to equipment, other than armor or weapons used by a monster. A creature that customarily wears clothes, such as a humanoid, is assumed to be dressed appropriately.\n\nYou can equip monsters with additional gear·and trinkets however you like, using the equipment chapter· of the *Player's Handbook* for inspiration, and you decide how much of a monster's equipment is recoverable after the creature is slain and whether any of that equipment is still usable. A battered suit of armor made for a monster is rarely usable by someone else, for instance.\n\nIf a spellcasting monster needs material components . to cast its spells, assume that it has the material components it needs to cast the spells in its stat block.\n\n# LEGENDARY CREATURES\n\nA legendary creature can do things that ordinary creatures can't. Legendary creatures can take special actions outside their turns, and a few can exert power over their environment, causing extraordinary magical effects to occur in their vicinity.\n\n# LEGENDARY ACTIONS\n\nA legendary creature can take a certain number of special actions- called legendary actions- outside its turn. Only one legendary action option can be used at a time and only at the end of another creature's turn. A legendary creature regains spent legendary actions at the start of its turn. It isn't required to use its legendary actions, and it can't use legendary actions while incapacitated.\n\n## A LEGENDARY CREATURE's LAIR\n\nA legendary creature might have a section describing its lair and the special effects it can create while there, either by act of will or simply by being present. Not all legendary creatures have lairs. This section only applies to legendary creatures that spend a great deal of time in their lairs and are most likely to be encountered there.\n\n## LAIR AcTIONS\n\nIf a legendary creature has lair actions, it can use them to harness the ambient magic in its lair. On initiative count 20 (losing all initiative ties), the creature can use one of its lair action options, or forgo using any of them that round.\n\n#### REGIONAL EFFECTS\n\nThe mere presence of a legendary creature can have strange and wondrous effects on its environment, as noted in this section. Regional effects end abruptly or dissipate over time when the legendary creature.dies. ·",
  "regions": [],
  "entities": []
}
