{
  "$schema": "../label.schema.json",
  "id": "phb-p077",
  "goldsetVersion": 1,
  "source": {
    "sha256": "ccd242684b0c6c2117d2fd614c2bc6a8d9b0c9db73cdc57509b8bc5b51997a2a",
    "pageNumber": 77,
    "title": "5th Edition - Players Handbook"
  },
  "category": "heavy_art",
  "heldOut": false,
  "status": "verified",
  "review": {
    "verifiedBy": "joel",
    "verifiedAt": "2026-10-29T02:53:49.005Z",
    "numbersChecked": true,
    "notes": ""
  },
  "text": "Monk\n\nHer fists a blur as they deflect an incoming hail of arrows, a half-elf springs over a barricade and throws herself into the massed ranks of hobgoblins on the other side. She whirls among them, knocking their blows aside and sending them reeling, until at last she stands alone.\n\nTaking a deep breath, a human covered in tattoos settles into a battle stance. As the first charging orcs reach him, he exhales and a blast of fire roars from his mouth, engulfing his foes.\n\nMoving with the silence of the night, a black-clad halfling steps into a shadow beneath an arch and emerges from another inky shadow on a balcony a stone's throw away. She slides her blade free of its cloth-wrapped scabbard and peers through the open window at the tyrant prince, so vulnerable in the grip of sleep.\n\nWhatever their discipline, monks are united in their ability to magically harness the energy that flows in their bodies. Whether channeled as a striking display of combat prowess or a subtler focus of defensive ability and speed, this energy infuses all that a monk does.\n\nThe Magic of Ki\n\nMonks make careful study of a magical energy that most monastic traditions call ki. This energy is an element of the magic that suffuses the multiverse—specifically, the element that flows through living bodies. Monks harness this power within themselves to create magical effects and exceed their bodies' physical capabilities, and some of their special attacks can hinder the flow of ki in their opponents. Using this energy, monks channel uncanny speed and strength into their unarmed strikes. As they gain experience, their martial training and their mastery of ki gives them more power over their bodies and the bodies of their foes.\n\nTraining and Asceticism\n\nSmall walled cloisters dot the landscapes of the worlds of D&D, tiny refuges from the flow of ordinary life, where time seems to stand still. The monks who live there seek personal perfection through contemplation and rigorous training. Many entered the monastery as children, sent to live there when their parents died, when food couldn't be found to support them, or in return for some kindness that the monks had performed for their families.\n\nSome monks live entirely apart from the surrounding population, secluded from anything that might impede their spiritual progress. Others are sworn to isolation,",
  "regions": [
    {
      "class": "art",
      "bbox": [
        0,
        0,
        0.5,
        1
      ]
    }
  ],
  "entities": []
}
