{
  "$schema": "../label.schema.json",
  "id": "mm-p3",
  "goldsetVersion": 1,
  "source": {
    "sha256": "6514c87c6c040c86b996acb2e4a5663b5e0065084842280f6b0a94b4c964ac3e",
    "pageNumber": 3,
    "title": "Monster Manual"
  },
  "category": "two_column_sidebar",
  "heldOut": false,
  "status": "verified",
  "review": {
    "verifiedBy": "joel",
    "verifiedAt": "2026-10-29T20:23:58.498Z",
    "numbersChecked": true,
    "notes": ""
  },
  "text": "#### CREDITS\n\nD&D Lead Designers: Mike Mearls, Jeremy Crawford\n\nMonster Manual Lead: Christopher Perkins\nStat Block Development: Chris Sims, Rodney Thompson,\nPeter Lee\n\nStory Development: Robert J. Schwalb, Matt Sernett, Steve Townshend, James Wyatt\n\nEditing: Scott Fitzgerald Gray Managing Editor: Jeremy Crawford\n\nProducer: Greg Bilsland\n\nArt Directors: Kate Irwin, Dan Gelon, Jon Schindehette, Mari Kolkowsky, Melissa Rapier, Shauna Narciso Graphic Designers: Bree Heiss, Emi Tanji, Barry Craig\n\nCover Illustrator: Raymond Swanland Interior Illustrators: Tom Babbey, Daren Bader, John-Paul Balmet, Mark Behm, Eric Belisle, Michael Berube, Zoltan Boros, Christopher Bradley, Aleksi Briclot, Filip Burburan, Christopher Burdett, Sam Burley, Mike Burns, Wesley Burt, Milivoj Čeran, Jedd Chevrier, Conceptopolis, Adam Danger Cook, Julie Dillon, Dave Dorman, Jesper Ejsing, Emrah Elmasli, Wayne England, Mike Faille, Toma Feizo Gas, Emily Fiegenschuh, Tomas Giorello, E.M. Gist, Lars Grant-West, E.W. Hekaton, jD, Jon Hodgson, Ralph Horsley, Kurt Huggins and Zelda Devon, Lake Hurwitz, Tyler Jacobson, Vance Kovacs, Daniel Landerman, Lindsey Look, Daniel Ljunggren, Raphael Lübke, Titus Lunter, Slawomir Maniak, Andrew Mar, Brynn Metheney, Christopher Moeller, Mark Molnar, Marco Nelor, Jim Nelson, Mark A. Nelson, Hector Ortiz, Ryan Pancoast, Adam Paquette, Jim Pavelec, Kate Pfeilschiefter, Steve Prescott, Vincent Proce, Darrell Riche, Ned Rogers, Scott Roller, Jasper Sandner, Mike Sass, Marc Sasso, Ilya Shkipin, Carmen Sinek, Craig J Spearing, Annie Stegg, Zack Stella, Matt Stewart, Raymond Swanland, Justin Sweet, Anne Stokes, Matias Tapia, Cory Trego-Erdner, Autumn Rain Turkel, Cyril Van Der Haegen, David Vargo, Franz Vohwinkel, Richard Whitters, Sam Wood, Ben Wootten, Kieran Yanner, Min Yum, Mark Zug\n\nAdditional Contributors: Bruce R. Cordell, Kim Mohan, Chris Dupuis, Tom LaPille, Miranda Horner, Jennifer Clarke Wilkes, Steve Winter, Chris Youngs, Ben Petrisor, Tom Olsen, R.A. Salvatore\n\nProject Management: Neil Shinkle, Kim Graham, John Hay Production Services: Cynda Callaway, Brian Dumas, Jefferson Dunlap, David Gershman, Matt Knannlein, Anita Williams\n\n**Brand and Marketing:** Nathan Stewart, Liz Schuh, Chris Lindsay, Shelly Mazzanoble, Hilary Ross, Laura Tommervik, Kim Lundstrom, Trevor Kidd\n\n### Based on the original game created by\n\nE. Gary Gygax and Dave Arneson, with Brian Blume, Rob Kuntz, James Ward, and Don Kaye Drawing from further development by\n\nJ. Eric Holmes, Tom Moldvay, Frank Mentzer, Aaron Allston, Harold Johnson, David \"Zeb\" Cook, Ed Greenwood, Keith Baker, Tracy Hickman, Margaret Weis, Douglas Niles, Jeff Grubb, Jonathan Tweet, Monte Cook, Skip Williams, Richard Baker, Peter Adkison, Bill Slavicsek, Andy Collins, and Rob Heinsoo\n\nPlaytesting provided by over 175,000 fans of D&D. Thank you!\n\nAdditional feedback provided by\n\nRobert Alaniz, Anthony Caroselli, Josh Dillard, Curt Duval, Sam E. Simpson Jr., Adam Hennebeck, Sterling Hershey, Paul Hughes, Doug Irwin, Ken J. Breese, Yan Lacharité, Tom Lommel, Jonathan Longstaff, Rory Madden, Matt Maranda, Paul Melamed, Mike Mihalas, David Milman, Daren Mitchell, Claudio Pozas, John Proudfoot, Karl Resch, M. Sean Molley, Sam Sherry, Pieter Sleijpen, David \"Oak\" Stark, Vincent Venturella, Fredrick Wheeler, Arthur Wright\n\n#### ON THE COVER\n\nRaymond Swanland illustrates the Xanathar ambushing explorers in the darkest depths of Undermountain, proving that the beholder crime lord's interests run deep beneath the city of Waterdeep.\n\n620A9218000001 EN ISBN: 978-0-7869-6561-8 First Printing: September 2014\n\nCE\n\nDisclaimer: Any similarities between monsters depicted in this book and monsters that actually exist are purely coincidental. That goes double for mind flayers, which absolutely, utterly, and completely do not exist, nor do they secretly run the D&D team. Do we really need a disclaimer to tell you that? You shouldn't use your brain to consider such irrational thoughts. They only make the mind cluttered, confused, and unpleasantly chewy. A good brain is nice, tender, and barely used. Go ahead, put down this book and watch some reality TV or Internet cat videos. They're really funny these days. You won't regret it. We say this only because we love you and your juicy, succulent gamer brain.\n\n987654321\n\nDUNGEONS & DRAGONS, D&D, Wizards of the Coast, Forgotten Realms, the dragon ampersand, Player's Handbook, Monster Manual, Dungeon Master's Guide, all other Wizards of the Coast product names, and their respective logos are trademarks of Wizards of the Coast in the USA and other countries. All characters and their distinctive likenesses are property of Wizards of the Coast. This material is protected under the copyright laws of the United States of America. Any reproduction or unauthorized use of the material or artwork contained herein is prohibited without the express written permission of Wizards of the Coast.\n\n© 2014 Wizards of the Coast LLC, PO Box 707, Renton, WA 98057-0707, USA. Manufactured by Hasbro SA, Rue Emile-Boéchat 31, 2800 Delémont, CH, Represented by Hasbro Europe, 4 The Square, Stockley Park. Uxbridge, Middlesex, UB11 1ET, UK, PRINTED IN THE USA.\nPlease retain company details for future reference.",
  "regions": [
    {
      "class": "art",
      "bbox": [
        0.101,
        0.5518,
        0.5865,
        0.8076
      ]
    }
  ],
  "entities": []
}
